{
  "$schema": "https://json-schema.org/draft/2020-12/schema",
  "type": "object",
  "properties": {
    "schemaVersion": {
      "type": "number",
      "const": 1
    },
    "a": {
      "$ref": "#/$defs/__schema0"
    },
    "b": {
      "$ref": "#/$defs/__schema0"
    },
    "identical": {
      "type": "boolean"
    },
    "firstDivergence": {
      "anyOf": [
        {
          "anyOf": [
            {
              "type": "object",
              "properties": {
                "index": {
                  "$ref": "#/$defs/__schema1"
                },
                "a": {
                  "$ref": "#/$defs/__schema3"
                },
                "b": {
                  "$ref": "#/$defs/__schema3"
                }
              },
              "required": ["index", "a"],
              "additionalProperties": false
            },
            {
              "type": "object",
              "properties": {
                "index": {
                  "$ref": "#/$defs/__schema1"
                },
                "b": {
                  "$ref": "#/$defs/__schema3"
                }
              },
              "required": ["index", "b"],
              "additionalProperties": false
            }
          ]
        },
        {
          "type": "null"
        }
      ]
    },
    "ops": {
      "type": "array",
      "items": {
        "oneOf": [
          {
            "type": "object",
            "properties": {
              "type": {
                "type": "string",
                "const": "equal"
              },
              "aIndex": {
                "$ref": "#/$defs/__schema1"
              },
              "bIndex": {
                "$ref": "#/$defs/__schema1"
              },
              "a": {
                "$ref": "#/$defs/__schema3"
              },
              "b": {
                "$ref": "#/$defs/__schema3"
              }
            },
            "required": ["type", "aIndex", "bIndex", "a", "b"],
            "additionalProperties": false
          },
          {
            "type": "object",
            "properties": {
              "type": {
                "type": "string",
                "const": "changed"
              },
              "aIndex": {
                "$ref": "#/$defs/__schema1"
              },
              "bIndex": {
                "$ref": "#/$defs/__schema1"
              },
              "a": {
                "$ref": "#/$defs/__schema3"
              },
              "b": {
                "$ref": "#/$defs/__schema3"
              },
              "detail": {
                "oneOf": [
                  {
                    "type": "object",
                    "properties": {
                      "kind": {
                        "type": "string",
                        "const": "json"
                      },
                      "changes": {
                        "type": "array",
                        "items": {
                          "$ref": "#/$defs/__schema6"
                        }
                      }
                    },
                    "required": ["kind", "changes"],
                    "additionalProperties": false
                  },
                  {
                    "type": "object",
                    "properties": {
                      "kind": {
                        "type": "string",
                        "const": "fields"
                      },
                      "changes": {
                        "type": "array",
                        "items": {
                          "$ref": "#/$defs/__schema6"
                        }
                      }
                    },
                    "required": ["kind", "changes"],
                    "additionalProperties": false
                  },
                  {
                    "type": "object",
                    "properties": {
                      "kind": {
                        "type": "string",
                        "const": "text"
                      },
                      "mode": {
                        "type": "string",
                        "enum": ["words", "lines"]
                      },
                      "changes": {
                        "type": "array",
                        "items": {
                          "type": "object",
                          "properties": {
                            "type": {
                              "type": "string",
                              "enum": ["equal", "added", "removed"]
                            },
                            "value": {
                              "type": "string"
                            }
                          },
                          "required": ["type", "value"],
                          "additionalProperties": false
                        }
                      },
                      "fields": {
                        "type": "array",
                        "items": {
                          "$ref": "#/$defs/__schema6"
                        }
                      }
                    },
                    "required": ["kind", "mode", "changes", "fields"],
                    "additionalProperties": false
                  }
                ]
              }
            },
            "required": ["type", "aIndex", "bIndex", "a", "b", "detail"],
            "additionalProperties": false
          },
          {
            "type": "object",
            "properties": {
              "type": {
                "type": "string",
                "const": "added"
              },
              "bIndex": {
                "$ref": "#/$defs/__schema1"
              },
              "b": {
                "$ref": "#/$defs/__schema3"
              }
            },
            "required": ["type", "bIndex", "b"],
            "additionalProperties": false
          },
          {
            "type": "object",
            "properties": {
              "type": {
                "type": "string",
                "const": "removed"
              },
              "aIndex": {
                "$ref": "#/$defs/__schema1"
              },
              "a": {
                "$ref": "#/$defs/__schema3"
              }
            },
            "required": ["type", "aIndex", "a"],
            "additionalProperties": false
          }
        ]
      }
    },
    "toolCalls": {
      "type": "object",
      "properties": {
        "added": {
          "$ref": "#/$defs/__schema1"
        },
        "removed": {
          "$ref": "#/$defs/__schema1"
        },
        "changed": {
          "$ref": "#/$defs/__schema1"
        }
      },
      "required": ["added", "removed", "changed"],
      "additionalProperties": false
    },
    "finalText": {
      "type": "object",
      "properties": {
        "a": {
          "type": "string"
        },
        "b": {
          "type": "string"
        },
        "changed": {
          "type": "boolean"
        }
      },
      "required": ["a", "b", "changed"],
      "additionalProperties": false
    },
    "totals": {
      "type": "object",
      "properties": {
        "a": {
          "$ref": "#/$defs/__schema9"
        },
        "b": {
          "$ref": "#/$defs/__schema9"
        },
        "delta": {
          "type": "object",
          "properties": {
            "calls": {
              "type": "integer",
              "minimum": -9007199254740991,
              "maximum": 9007199254740991,
              "$ref": "#/$defs/__schema2"
            },
            "inputTokens": {
              "type": "integer",
              "minimum": -9007199254740991,
              "maximum": 9007199254740991,
              "$ref": "#/$defs/__schema2"
            },
            "outputTokens": {
              "type": "integer",
              "minimum": -9007199254740991,
              "maximum": 9007199254740991,
              "$ref": "#/$defs/__schema2"
            },
            "tokens": {
              "type": "integer",
              "minimum": -9007199254740991,
              "maximum": 9007199254740991,
              "$ref": "#/$defs/__schema2"
            },
            "costUsd": {
              "anyOf": [
                {
                  "$ref": "#/$defs/__schema2"
                },
                {
                  "type": "null"
                }
              ]
            },
            "latencyMs": {
              "$ref": "#/$defs/__schema2"
            }
          },
          "required": [
            "calls",
            "inputTokens",
            "outputTokens",
            "tokens",
            "costUsd",
            "latencyMs"
          ],
          "additionalProperties": false
        }
      },
      "required": ["a", "b", "delta"],
      "additionalProperties": false
    },
    "byModel": {
      "type": "array",
      "items": {
        "type": "object",
        "properties": {
          "model": {
            "type": ["string", "null"]
          },
          "a": {
            "$ref": "#/$defs/__schema10"
          },
          "b": {
            "$ref": "#/$defs/__schema10"
          }
        },
        "required": ["model", "a", "b"],
        "additionalProperties": false
      }
    }
  },
  "required": [
    "schemaVersion",
    "a",
    "b",
    "identical",
    "firstDivergence",
    "ops",
    "toolCalls",
    "finalText",
    "totals",
    "byModel"
  ],
  "additionalProperties": false,
  "$defs": {
    "__schema0": {
      "type": "object",
      "properties": {
        "name": {
          "type": ["string", "null"]
        },
        "path": {
          "type": "string"
        },
        "createdAt": {
          "type": "string",
          "format": "date-time",
          "pattern": "^(?:(?:\\d\\d[2468][048]|\\d\\d[13579][26]|\\d\\d0[48]|[02468][048]00|[13579][26]00)-02-29|\\d{4}-(?:(?:0[13578]|1[02])-(?:0[1-9]|[12]\\d|3[01])|(?:0[469]|11)-(?:0[1-9]|[12]\\d|30)|(?:02)-(?:0[1-9]|1\\d|2[0-8])))T(?:(?:[01]\\d|2[0-3]):[0-5]\\d:[0-5]\\d(?:\\.\\d+)?(?:Z|([+-](?:[01]\\d|2[0-3]):[0-5]\\d)))$"
        }
      },
      "required": ["name", "path", "createdAt"],
      "additionalProperties": false
    },
    "__schema1": {
      "type": "integer",
      "minimum": 0,
      "maximum": 9007199254740991,
      "$ref": "#/$defs/__schema2"
    },
    "__schema2": {
      "type": "number"
    },
    "__schema3": {
      "oneOf": [
        {
          "type": "object",
          "properties": {
            "kind": {
              "type": "string",
              "const": "llm_call"
            },
            "seq": {
              "$ref": "#/$defs/__schema1"
            },
            "provider": {
              "type": "string",
              "enum": ["openai", "anthropic", "unknown"]
            },
            "model": {
              "type": ["string", "null"]
            },
            "inputTokens": {
              "$ref": "#/$defs/__schema1"
            },
            "outputTokens": {
              "$ref": "#/$defs/__schema1"
            },
            "costUsd": {
              "$ref": "#/$defs/__schema4"
            },
            "latencyMs": {
              "minimum": 0,
              "$ref": "#/$defs/__schema2"
            },
            "status": {
              "type": "integer",
              "minimum": 100,
              "maximum": 599,
              "$ref": "#/$defs/__schema2"
            }
          },
          "required": [
            "kind",
            "seq",
            "provider",
            "model",
            "inputTokens",
            "outputTokens",
            "costUsd",
            "latencyMs",
            "status"
          ],
          "additionalProperties": false
        },
        {
          "type": "object",
          "properties": {
            "kind": {
              "type": "string",
              "const": "tool_call"
            },
            "id": {
              "type": "string"
            },
            "name": {
              "type": "string"
            },
            "args": {
              "$ref": "#/$defs/__schema5"
            }
          },
          "required": ["kind", "id", "name", "args"],
          "additionalProperties": false
        },
        {
          "type": "object",
          "properties": {
            "kind": {
              "type": "string",
              "const": "tool_result"
            },
            "id": {
              "type": "string"
            },
            "name": {
              "type": "string"
            },
            "content": {
              "type": "string"
            },
            "isError": {
              "type": "boolean"
            }
          },
          "required": ["kind", "id", "content"],
          "additionalProperties": false
        },
        {
          "type": "object",
          "properties": {
            "kind": {
              "type": "string",
              "const": "text"
            },
            "content": {
              "type": "string"
            }
          },
          "required": ["kind", "content"],
          "additionalProperties": false
        },
        {
          "type": "object",
          "properties": {
            "kind": {
              "type": "string",
              "const": "input"
            },
            "role": {
              "type": "string",
              "enum": ["user", "system"]
            },
            "content": {
              "type": "string"
            }
          },
          "required": ["kind", "role", "content"],
          "additionalProperties": false
        },
        {
          "type": "object",
          "properties": {
            "kind": {
              "type": "string",
              "const": "error"
            },
            "status": {
              "type": "integer",
              "minimum": 100,
              "maximum": 599,
              "$ref": "#/$defs/__schema2"
            },
            "message": {
              "type": "string"
            }
          },
          "required": ["kind", "status", "message"],
          "additionalProperties": false
        }
      ]
    },
    "__schema4": {
      "anyOf": [
        {
          "minimum": 0,
          "$ref": "#/$defs/__schema2"
        },
        {
          "type": "null"
        }
      ]
    },
    "__schema5": {
      "anyOf": [
        {
          "type": "string"
        },
        {
          "type": "number"
        },
        {
          "type": "boolean"
        },
        {
          "type": "null"
        },
        {
          "type": "array",
          "items": {
            "$ref": "#/$defs/__schema5"
          }
        },
        {
          "type": "object",
          "propertyNames": {
            "type": "string"
          },
          "additionalProperties": {
            "$ref": "#/$defs/__schema5"
          }
        }
      ]
    },
    "__schema6": {
      "type": "object",
      "properties": {
        "path": {
          "type": "string"
        },
        "before": {
          "$ref": "#/$defs/__schema7"
        },
        "after": {
          "$ref": "#/$defs/__schema8"
        }
      },
      "required": ["path"],
      "additionalProperties": false
    },
    "__schema7": {
      "anyOf": [
        {
          "type": "string"
        },
        {
          "type": "number"
        },
        {
          "type": "boolean"
        },
        {
          "type": "null"
        },
        {
          "type": "array",
          "items": {
            "$ref": "#/$defs/__schema7"
          }
        },
        {
          "type": "object",
          "propertyNames": {
            "type": "string"
          },
          "additionalProperties": {
            "$ref": "#/$defs/__schema7"
          }
        }
      ]
    },
    "__schema8": {
      "anyOf": [
        {
          "type": "string"
        },
        {
          "type": "number"
        },
        {
          "type": "boolean"
        },
        {
          "type": "null"
        },
        {
          "type": "array",
          "items": {
            "$ref": "#/$defs/__schema8"
          }
        },
        {
          "type": "object",
          "propertyNames": {
            "type": "string"
          },
          "additionalProperties": {
            "$ref": "#/$defs/__schema8"
          }
        }
      ]
    },
    "__schema9": {
      "type": "object",
      "properties": {
        "calls": {
          "$ref": "#/$defs/__schema1"
        },
        "inputTokens": {
          "$ref": "#/$defs/__schema1"
        },
        "outputTokens": {
          "$ref": "#/$defs/__schema1"
        },
        "tokens": {
          "$ref": "#/$defs/__schema1"
        },
        "costUsd": {
          "$ref": "#/$defs/__schema4"
        },
        "latencyMs": {
          "minimum": 0,
          "$ref": "#/$defs/__schema2"
        }
      },
      "required": [
        "calls",
        "inputTokens",
        "outputTokens",
        "tokens",
        "costUsd",
        "latencyMs"
      ],
      "additionalProperties": false
    },
    "__schema10": {
      "type": "object",
      "properties": {
        "calls": {
          "$ref": "#/$defs/__schema1"
        },
        "tokens": {
          "$ref": "#/$defs/__schema1"
        },
        "costUsd": {
          "$ref": "#/$defs/__schema4"
        }
      },
      "required": ["calls", "tokens", "costUsd"],
      "additionalProperties": false
    }
  },
  "title": "tapediff diff v1",
  "description": "Behavioral comparison of two recorded runs. See docs/diff-json-schema.md for semantics."
}
