{
  "a": {
    "createdAt": "2026-10-08T12:00:00.000Z",
    "name": "baseline",
    "path": "baseline.tape"
  },
  "b": {
    "createdAt": "2026-10-08T12:00:00.000Z",
    "name": "candidate",
    "path": "candidate.tape"
  },
  "byModel": [
    {
      "a": {
        "calls": 2,
        "costUsd": 0.006224,
        "tokens": 2584
      },
      "b": {
        "calls": 0,
        "costUsd": 0,
        "tokens": 0
      },
      "model": "gpt-4.1"
    },
    {
      "a": {
        "calls": 0,
        "costUsd": 0,
        "tokens": 0
      },
      "b": {
        "calls": 2,
        "costUsd": 0.01,
        "tokens": 4176
      },
      "model": "gpt-4o"
    }
  ],
  "finalText": {
    "a": "It's 18°C and sunny in Paris.",
    "b": "It's 18°C and sunny in Paris.",
    "changed": false
  },
  "firstDivergence": {
    "a": {
      "costUsd": 0.003112,
      "inputTokens": 1204,
      "kind": "llm_call",
      "latencyMs": 820,
      "model": "gpt-4.1",
      "outputTokens": 88,
      "provider": "openai",
      "seq": 0,
      "status": 200
    },
    "index": 1
  },
  "identical": false,
  "ops": [
    {
      "a": {
        "content": "Weather and time in Paris?",
        "kind": "input",
        "role": "user"
      },
      "aIndex": 0,
      "b": {
        "content": "Weather and time in Paris?",
        "kind": "input",
        "role": "user"
      },
      "bIndex": 0,
      "type": "equal"
    },
    {
      "a": {
        "costUsd": 0.003112,
        "inputTokens": 1204,
        "kind": "llm_call",
        "latencyMs": 820,
        "model": "gpt-4.1",
        "outputTokens": 88,
        "provider": "openai",
        "seq": 0,
        "status": 200
      },
      "aIndex": 1,
      "type": "removed"
    },
    {
      "b": {
        "costUsd": 0.005,
        "inputTokens": 2000,
        "kind": "llm_call",
        "latencyMs": 1200,
        "model": "gpt-4o",
        "outputTokens": 88,
        "provider": "openai",
        "seq": 0,
        "status": 200
      },
      "bIndex": 1,
      "type": "added"
    },
    {
      "a": {
        "content": "Checking. ",
        "kind": "text"
      },
      "aIndex": 2,
      "b": {
        "content": "Checking. ",
        "kind": "text"
      },
      "bIndex": 2,
      "type": "equal"
    },
    {
      "a": {
        "args": {
          "city": "Paris"
        },
        "id": "call_weather",
        "kind": "tool_call",
        "name": "get_weather"
      },
      "aIndex": 3,
      "b": {
        "args": {
          "city": "Paris"
        },
        "id": "call_weather",
        "kind": "tool_call",
        "name": "get_weather"
      },
      "bIndex": 3,
      "type": "equal"
    },
    {
      "a": {
        "args": {
          "zone": "Europe/Paris"
        },
        "id": "call_time",
        "kind": "tool_call",
        "name": "get_time"
      },
      "aIndex": 4,
      "b": {
        "args": {
          "zone": "Europe/Paris"
        },
        "id": "call_time",
        "kind": "tool_call",
        "name": "get_time"
      },
      "bIndex": 4,
      "type": "equal"
    },
    {
      "a": {
        "content": "18°C, sunny",
        "id": "call_weather",
        "kind": "tool_result",
        "name": "get_weather"
      },
      "aIndex": 5,
      "b": {
        "content": "18°C, sunny",
        "id": "call_weather",
        "kind": "tool_result",
        "name": "get_weather"
      },
      "bIndex": 5,
      "type": "equal"
    },
    {
      "a": {
        "content": "12:00",
        "id": "call_time",
        "kind": "tool_result",
        "name": "get_time"
      },
      "aIndex": 6,
      "b": {
        "content": "12:00",
        "id": "call_time",
        "kind": "tool_result",
        "name": "get_time"
      },
      "bIndex": 6,
      "type": "equal"
    },
    {
      "a": {
        "costUsd": 0.003112,
        "inputTokens": 1204,
        "kind": "llm_call",
        "latencyMs": 820,
        "model": "gpt-4.1",
        "outputTokens": 88,
        "provider": "openai",
        "seq": 1,
        "status": 200
      },
      "aIndex": 7,
      "type": "removed"
    },
    {
      "b": {
        "costUsd": 0.005,
        "inputTokens": 2000,
        "kind": "llm_call",
        "latencyMs": 1200,
        "model": "gpt-4o",
        "outputTokens": 88,
        "provider": "openai",
        "seq": 1,
        "status": 200
      },
      "bIndex": 7,
      "type": "added"
    },
    {
      "a": {
        "content": "It's 18°C and sunny in Paris.",
        "kind": "text"
      },
      "aIndex": 8,
      "b": {
        "content": "It's 18°C and sunny in Paris.",
        "kind": "text"
      },
      "bIndex": 8,
      "type": "equal"
    }
  ],
  "schemaVersion": 1,
  "toolCalls": {
    "added": 0,
    "changed": 0,
    "removed": 0
  },
  "totals": {
    "a": {
      "calls": 2,
      "costUsd": 0.006224,
      "inputTokens": 2408,
      "latencyMs": 1640,
      "outputTokens": 176,
      "tokens": 2584
    },
    "b": {
      "calls": 2,
      "costUsd": 0.01,
      "inputTokens": 4000,
      "latencyMs": 2400,
      "outputTokens": 176,
      "tokens": 4176
    },
    "delta": {
      "calls": 0,
      "costUsd": 0.003776,
      "inputTokens": 1592,
      "latencyMs": 760,
      "outputTokens": 0,
      "tokens": 1592
    }
  }
}
